{
  "captured_at": "2026-01-27T07:32:49.473789Z",
  "error": "open config/prompt.shopee.product.txt: no such file or directory",
  "status": "error",
  "url": "https://shopee.tw/OOFY%E9%9D%B4-%E5%A4%A7%E5%B0%BA%E7%A2%BC-%E8%8B%B1%E5%80%AB%E5%BE%A9%E5%8F%A4%E7%99%BD%E8%89%B2%E8%BB%8A%E7%B8%AB%E7%B7%9A%E5%8E%9A%E5%BA%95%E9%A6%AC%E4%B8%81%E7%9A%AE%E9%9D%B4-%E6%99%82%E5%B0%9A%E6%BD%AE%E6%B5%81%E8%A8%AD%E8%A8%88%E6%AC%BE%E7%B6%81%E5%B8%B6%E9%A2%A8%E8%BB%8D%E9%9D%B4-%E6%96%B9%E4%BE%BF%E5%81%B4%E6%8B%89%E9%8D%8A%E4%B8%AD%E7%AD%92%E9%9D%B4-%E7%B6%81%E5%B8%B6%E9%A2%A8%E9%A6%AC%E4%B8%81%E9%9D%B4-%E6%AD%A3%E5%B8%B8-i.179129213.13437612125?extraParams=%7B%22display_model_id%22%3A187331545102%7D"
}
